name,attack,defense,cost,type,text
Deadbridge Chant,,,{4}{B}{G},Enchantment,"When Deadbridge Chant enters the battlefield , put the top ten cards of your library into your graveyard . $At the beginning of your upkeep , choose a card at random in your graveyard . If it's a creature card , put it onto the battlefield . Otherwise , put it into your hand ."
Izzet Cluestone,,,{3},Artifact,"{ tap }: Add { U } or { R } to your mana pool . ${U}{R } , { tap } , Sacrifice Izzet Cluestone : Draw a card ."
Morgue Burst,,,{4}{B}{R},Sorcery,Return target creature card from your graveyard to your hand . Morgue Burst deals damage to target creature or player equal to the power of the card returned this way .
Render Silent,,,{W}{U}{U},Instant,Counter target spell . Its controller can't cast spells this turn .
Skylasher,2,2,{1}{G},Creature - Insect,"Flash$Skylasher can't be countered . $Reach , protection from blue"
Warped Physique,,,{U}{B},Instant,"Target creature gets +X/-X until end of turn , where X is the number of cards in your hand ."
Atarka Monument,,,{3},Artifact,{ T }: Add { R } or { G } to your mana pool . ${4}{R}{G }: Atarka Monument becomes a 4/4 red and green Dragon artifact creature with flying until end of turn .
Commune with Lava,,,{X}{R}{R},Instant,"Exile the top X cards of your library . Until the end of your next turn , you may play those cards ."
Dragonlord Atarka,8,8,{5}{R}{G},Legendary Creature - Elder Dragon,"Flying , trample$When Dragonlord Atarka enters the battlefield , it deals 5 damage divided as you choose among any number of target creatures and/or planeswalkers your opponents control ."
Encase in Ice,,,{1}{U},Enchantment - Aura,"Flash$Enchant red or green creature$When Encase in Ice enters the battlefield , tap enchanted creature . $Enchanted creature doesn't untap during its controller's untap step ."
Hand of Silumgar,1,2,{1}{B},Creature - Human Warrior,Deathtouch < i > (Any amount of damage this deals to a creature is enough to destroy it . ) < /i >
Learn from the Past,,,{3}{U},Instant,Target player shuffles his or her graveyard into his or her library$Draw a card
Ojutai Monument,,,{3},Artifact,{ T }: Add { W } or { U } to your mana pool . ${4}{W}{U }: Ojutai Monument becomes a 4/4 white and blue Dragon artifact creature with flying until end of turn .
Resupply,,,{5}{W},Instant,You gain 6 life . $Draw a card .
Seismic Rupture,,,{2}{R},Sorcery,Seismic Rupture deals 2 damage to each creature without flying .
Silumgar Spell-Eater,3,2,{2}{U},Creature - Naga Wizard,"Megamorph { 4}{U } < i > (You may cast this card face down as a 2/2 creature for { 3 } . Turn it face up any time for its megamorph cost and put a +1/+1 counter on it . ) < /i > $When Silumgar Spell-Eater is turned face up , counter target spell unless its controller pays { 3 } ."
Tread Upon,,,{1}{G},Instant,Target creature gets +2/+2 and gains trample until end of turn .
Distorting Lens,,,{2},Artifact,{ tap }: Target permanent becomes the color of your choice until end of turn .
Blinding Beam,,,{2}{W},Instant,Choose one - Tap two target creatures ; or creatures don't untap during target player's next untap step . $Entwine { 1 } < i > (Choose both if you pay the entwine cost . ) < /i >
Swell of Courage,,,{3}{W}{W},Instant,"Creatures you control get +2/+2 until end of turn . $Reinforce X-{X}{W}{W } < i > ({X}{W}{W } , Discard this card : Put X +1/+1 counters on target creature . ) < /i >"
"Ashling, the Extinguisher",4,4,{2}{B}{B},Legendary Creature - Elemental Shaman,"Whenever Ashling , the Extinguisher deals combat damage to a player , choose target creature that player controls . He or she sacrifices that creature ."
Crackleburr,2,2,{1}{UR}{UR},Creature - Elemental,"{ UR}{UR } , { tap } , Tap two untapped red creatures you control : Crackleburr deals 3 damage to target creature or player . ${UR}{UR } , { untap } , Untap two tapped blue creatures you control : Return target creature to its owner's hand . < i > ({untap } is the untap symbol . ) < /i >"
Evershrike,2,2,{3}{WB}{WB},Creature - Elemental Spirit,"Flying$Evershrike gets +2/+2 for each Aura attached to it . ${X}{WB}{WB }: Return Evershrike from your graveyard to the battlefield . You may put an Aura card with converted mana cost X or less from your hand onto the battlefield attached to it . If you don't , exile Evershrike ."
Hateflayer,5,5,{5}{R}{R},Creature - Elemental,"Wither < i > (This deals damage to creatures in the form of -1/-1 counters . ) < /i > ${2}{R } , { untap }: Hateflayer deals damage equal to its power to target creature or player . < i > ({untap } is the untap symbol . ) < /i >"
Marshdrinker Giant,3,4,{3}{G}{G},Creature - Giant Warrior,"When Marshdrinker Giant enters the battlefield , destroy target Island or Swamp an opponent controls ."
Oona's Grace,,,{2}{U},Instant,Target player draws a card . $Retrace < i > (You may cast this card from your graveyard by discarding a land card in addition to paying its other costs . ) < /i >
Sapling of Colfenor,5,2,{3}{BG}{BG},Legendary Creature - Treefolk Shaman,"Sapling of Colfenor is indestructible . $Whenever Sapling of Colfenor attacks , reveal the top card of your library . If it's a creature card , you gain life equal to that card's toughness , lose life equal to its power , then put it into your hand ."
Stillmoon Cavalier,1,2,{1}{WB}{WB},Creature - Zombie Knight,Protection from white and from black${WB }: Stillmoon Cavalier gains flying until end of turn . ${WB }: Stillmoon Cavalier gains first strike until end of turn . ${WB}{WB }: Stillmoon Cavalier gets +1/+0 until end of turn .
Ward of Bones,,,{6},Artifact,"Each opponent who controls more creatures than you can't play creature cards . The same is true for artifacts , enchantments , and lands ."
Equilibrium,,,{1}{U}{U},Enchantment,"Whenever you cast a creature spell , you may pay { 1 } . If you do , return target creature to its owner's hand ."
Onslaught,,,{R},Enchantment,"Whenever you cast a creature spell , tap target creature ."
Sphere of Resistance,,,{2},Artifact,Spells cost { 1 } more to cast .
Dwarven Lieutenant,2,1,{R}{R},Creature - Dwarf Soldier,{ 1}{R }: Target Dwarf creature gets +1/+0 until end of turn .
Icatian Lieutenant,2,1,{W}{W},Creature - Human Soldier,{ 1}{W }: Target Soldier creature gets +1/+0 until end of turn .
Abzan Advantage,,,{1}{W},Instant,Target player sacrifices an enchantment . Bolster 1 . < i > (Choose a creature with the least toughness among creatures you control and put a +1/+1 counter on it . ) < /i >
Battlefront Krushok,4,3,{4}{G},Creature - Beast,Battlefront Krushok can't be blocked by more than one creature . $Each creature you control with a +1/+1 counter on it can't be blocked by more than one creature .
"Dromoka, the Eternal",5,5,{3}{G}{W},Legendary Creature - Dragon,"Flying$Whenever a Dragon you control attacks , bolster 2 . < i > (Choose a creature with the least toughness among creatures you control and put two +1/+1 counters on it . ) < /i >"
Grave Strength,,,{1}{B},Sorcery,"Choose target creature . Put the top three cards of your library into your graveyard , then put a +1/+1 counter on that creature for each creature card in your graveyard ."
Map the Wastes,,,{2}{G},Sorcery,"Search your library for a basic land card , put it onto the battlefield tapped , then shuffle your library . Bolster 1 . < i > (Choose a creature with the least toughness among creatures you control and put a +1/+1 counter on it . ) < /i >"
Pilgrim of the Fires,4,6,{7},Artifact Creature - Golem,"First strike , trample"
Shaman of the Great Hunt,2,4,{3}{R},Creature - Orc Shaman,"Haste$Whenever a creature you control deals combat damage to a player , put a +1/+1 counter on it . $Ferocious - { 2}{GU}{GU }: Draw a card for each creature you control with power 4 or greater ."
Temur Runemark,,,{2}{G},Enchantment - Aura,Enchant creature$Enchanted creature gets +2/+2 . $Enchanted creature has trample as long as you control a blue or red permanent .
Yasova Dragonclaw,2,4,{2}{G},Legendary Creature - Human Warrior,"Trample$At the beginning of combat on your turn , you may pay { 1}{UR}{UR } . If you do , gain control of target creature an opponent controls with power less than Yasova Dragonclaw's power until end of turn , untap that creature , and it gains haste until end of turn ."
Bringer of the Green Dawn,5,5,{7}{G}{G},Creature - Bringer,"You may pay { W}{U}{B}{R}{G } rather than pay Bringer of the Green Dawn's mana cost . $Trample$At the beginning of your upkeep , you may put a 3/3 green Beast creature token onto the battlefield ."
Eternal Witness,1,2,{1}{G}{G},Creature - Human Shaman,"When Eternal Witness enters the battlefield , you may return target card from your graveyard to your hand ."
Horned Helm,,,{2},Artifact - Equipment,Equipped creature gets +1/+1 and has trample . ${G}{G }: Attach Horned Helm to target creature you control . $Equip { 1 } < i > ({1 }: Attach to target creature you control . Equip only as a sorcery . ) < /i >
Myr Quadropod,4,1,{4},Artifact Creature - Myr,{ 3 }: Switch Myr Quadropod's power and toughness until end of turn .
Serum Visions,,,{U},Sorcery,"Draw a card . $Scry 2 . < i > (To scry 2 , look at the top two cards of your library , then put any number of them on the bottom of your library and the rest on top in any order . ) < /i >"
Tyrranax,4,5,{4}{G}{G},Creature - Beast,{ 1}{G }: Tyrranax gets -1/+1 until end of turn .
Blight,,,{B}{B},Enchantment - Aura,"Enchant land$When enchanted land becomes tapped , destroy it ."
Feroz's Ban,,,{6},Artifact,Creature spells cost { 2 } more to cast .
Living Artifact,,,{G},Enchantment - Aura,"Enchant artifact$Whenever you're dealt damage , put that many vitality counters on Living Artifact . $At the beginning of your upkeep , you may remove a vitality counter from Living Artifact . If you do , you gain 1 life ."
Repentant Blacksmith,2,1,{1}{W},Creature - Human,Protection from red
War Mammoth,3,3,{3}{G},Creature - Elephant,Trample
Immolation,,,{R},Enchantment - Aura,Enchant creature$Enchanted creature gets +2/-2 .
Arcanum Wings,,,{1}{U},Enchantment - Aura,Enchant creature$Enchanted creature has flying . $Aura swap { 2}{U } < i > ({2}{U }: Exchange this Aura with an Aura card in your hand . ) < /i >
Cyclical Evolution,,,{3}{G}{G},Sorcery,"Target creature gets +3/+3 until end of turn . Exile Cyclical Evolution with three time counters on it . $Suspend 3-{2}{G } < i > (Rather than cast this card from your hand , you may pay { 2}{G } and exile it with three time counters on it . At the beginning of your upkeep , remove a time counter . When the last is removed , cast it without paying its mana cost . ) < /i >"
Henchfiend of Ukor,2,3,{3}{R},Creature - Ogre,"Haste$Echo { 1}{B } < i > (At the beginning of your upkeep , if this came under your control since the beginning of your last upkeep , sacrifice this permanent unless you pay its echo cost . ) < /i > ${BR }: Henchfiend of Ukor gets +1/+0 until end of turn ."
Magus of the Moat,3,0,{2}{W}{W},Creature - Human Wizard,Creatures without flying can't attack .
Saltskitter,4,3,{3}{W},Creature - Wurm,"Whenever another creature enters the battlefield , exile Saltskitter . Return Saltskitter to the battlefield under its owner's control at the beginning of the next end step ."
Thornweald Archer,1,2,{1}{G},Creature - Elf Archer,Reach < i > (This creature can block creatures with flying . ) < /i > $Deathtouch < i > (Any amount of damage this deals to a creature is enough to destroy it . ) < /i >
Angelic Edict,,,{4}{W},Sorcery,Exile target creature or enchantment .
Boros Keyrune,,,{3},Artifact,{ tap }: Add { R } or { W } to your mana pool . ${R}{W }: Boros Keyrune becomes a 1/1 red and white Soldier artifact creature with double strike until end of turn . < i > (It deals both first-strike and regular combat damage . ) < /i >
Deathpact Angel,5,5,{3}{W}{B}{B},Creature - Angel,"Flying$When Deathpact Angel dies , put a 1/1 white and black Cleric creature token onto the battlefield . It has "" { 3}{W}{B}{B } , { tap } , Sacrifice this creature : Return a card named Deathpact Angel from your graveyard to the battlefield . """
Experiment One,1,1,{G},Creature - Human Ooze,"Evolve < i > (Whenever a creature enters the battlefield under your control , if that creature has greater power or toughness than this creature , put a +1/+1 counter on this creature . ) < /i > $Remove two +1/+1 counters from Experiment One : Regenerate Experiment One ."
Grisly Spectacle,,,{2}{B}{B},Instant,Destroy target nonartifact creature . Its controller puts a number of cards equal to that creature's power from the top of his or her library into his or her graveyard .
Illness in the Ranks,,,{B},Enchantment,Creature tokens get -1/-1 .
Master Biomancer,4,2,{2}{G}{U},Creature - Elf Wizard,Each other creature you control enters the battlefield with a number of additional +1/+1 counters on it equal to Master Biomancer's power and as a Mutant in addition to its other types .
One Thousand Lashes,,,{2}{W}{B},Enchantment - Aura,"Enchant creature$Enchanted creature can't attack or block , and its activated abilities can't be activated . $At the beginning of the upkeep of enchanted creature's controller , that player loses 1 life ."
Rubblehulk,*,*,{4}{R}{G},Creature - Elemental,"Rubblehulk's power and toughness are each equal to the number of lands you control . $Bloodrush - { 1}{R}{G } , Discard Rubblehulk : Target attacking creature gets +X/+X until end of turn , where X is the number of lands you control ."
Simic Manipulator,1,0,{1}{U}{U},Creature - Mutant Wizard,"Evolve < i > (Whenever a creature enters the battlefield under your control , if that creature has greater power or toughness than this creature , put a +1/+1 counter on this creature . ) < /i > ${tap } , Remove one or more +1/+1 counters from Simic Manipulator : Gain control of target creature with power less than or equal to the number of +1/+1 counters removed this way ."
Thespian's Stage,,,,Land,"{ tap }: Add { C } to your mana pool . ${2 } , { tap }: Thespian's Stage becomes a copy of target land and gains this ability ."
Way of the Thief,,,{3}{U},Enchantment - Aura,Enchant creature$Enchanted creature gets +2/+2 . $Enchanted creature is unblockable as long as you control a Gate .
Cremate,,,{B},Instant,Exile target card from a graveyard . $Draw a card .
Gigadrowse,,,{U},Instant,"Replicate { U } < i > (When you cast this spell , copy it for each time you paid its replicate cost . You may choose new targets for the copies . ) < /i > $Tap target permanent ."
Leyline of Lifeforce,,,{2}{G}{G},Enchantment,"If Leyline of Lifeforce is in your opening hand , you may begin the game with it on the battlefield . $Creature spells can't be countered ."
Poisonbelly Ogre,3,3,{4}{B},Creature - Ogre Warrior,"Whenever another creature enters the battlefield , its controller loses 1 life ."
Skyrider Trainee,3,3,{4}{W},Creature - Human Soldier,Skyrider Trainee has flying as long as it's enchanted .
Vedalken Plotter,1,1,{2}{U},Creature - Vedalken Wizard,"When Vedalken Plotter enters the battlefield , exchange control of target land you control and target land an opponent controls ."
Aliban's Tower,,,{1}{R},Instant,Target blocking creature gets +3/+1 until end of turn .
Eron the Relentless,2,5,{3}{R}{R},Legendary Creature - Human Rogue,Haste${R}{R}{R }: Regenerate Eron the Relentless .
Root Spider,2,2,{3}{G},Creature - Spider,"Whenever Root Spider blocks , it gets +1/+0 and gains first strike until end of turn ."
Balduvian Bears,2,2,{1}{G},Creature - Bear,
Elder Druid,2,2,{3}{G},Creature - Elf Cleric Druid,"{ 3}{G } , { tap }: You may tap or untap target artifact , creature , or land ."
Hecatomb,,,{1}{B}{B},Enchantment,"When Hecatomb enters the battlefield , sacrifice Hecatomb unless you sacrifice four creatures . $Tap an untapped Swamp you control : Hecatomb deals 1 damage to target creature or player ."
Lhurgoyf,1+*,*,{2}{G}{G},Creature - Lhurgoyf,Lhurgoyf's power is equal to the number of creature cards in all graveyards and its toughness is equal to that number plus 1 .
Pyknite,1,1,{2}{G},Creature - Ouphe,"When Pyknite enters the battlefield , draw a card at the beginning of the next turn's upkeep ."
Songs of the Damned,,,{B},Instant,Add { B } to your mana pool for each creature card in your graveyard .
Whiteout,,,{1}{G},Instant,All creatures lose flying until end of turn . $Sacrifice a snow land : Return Whiteout from your graveyard to your hand .
Ashmouth Hound,1,2,{1}{R},Creature - Elemental Hound,"Whenever Ashmouth Hound blocks or becomes blocked by a creature , Ashmouth Hound deals 1 damage to that creature ."
Cackling Counterpart,,,{1}{U}{U},Instant,Put a token onto the battlefield that's a copy of target creature you control . $Flashback { 5}{U}{U } < i > (You may cast this card from your graveyard for its flashback cost . Then exile it . ) < /i >
Curse of the Nightly Hunt,,,{2}{R},Enchantment - Aura Curse,Enchant player$Creatures enchanted player controls attack each turn if able .
Endless Ranks of the Dead,,,{2}{B}{B},Enchantment,"At the beginning of your upkeep , put X 2/2 black Zombie creature tokens onto the battlefield , where X is half the number of Zombies you control , rounded down ."
Gavony Township,,,,Land,"{ tap }: Add { C } to your mana pool . ${2}{G}{W } , { tap }: Put a +1/+1 counter on each creature you control ."
Hanweir Watchkeep,5,1,{2}{R},Creature - Human Warrior Werewolf,"Defender$At the beginning of each upkeep , if no spells were cast last turn , transform Hanweir Watchkeep ."
Kessig Wolf,1,3,{2}{R},Creature - Wolf,{ 1}{R }: Kessig Wolf gains first strike until end of turn .
Maw of the Mire,,,{4}{B},Sorcery,Destroy target land . You gain 4 life .
Nightbird's Clutches,,,{1}{R},Sorcery,Up to two target creatures can't block this turn . $Flashback { 3}{R } < i > (You may cast this card from your graveyard for its flashback cost . Then exile it . ) < /i >
Reckless Waif,1,1,{R},Creature - Human Rogue Werewolf,"At the beginning of each upkeep , if no spells were cast last turn , transform Reckless Waif ."
Skirsdag Cultist,2,2,{2}{R}{R},Creature - Human Shaman,"{ R } , { tap } , Sacrifice a creature : Skirsdag Cultist deals 2 damage to target creature or player ."
Sulfur Falls,,,,Land,Sulfur Falls enters the battlefield tapped unless you control an Island or a Mountain . ${tap }: Add { U } or { R } to your mana pool .
Unruly Mob,1,1,{1}{W},Creature - Human,"Whenever another creature you control dies , put a +1/+1 counter on Unruly Mob ."
Alloy Golem,4,4,{6},Artifact Creature - Golem,"As Alloy Golem enters the battlefield , choose a color . $Alloy Golem is the chosen color . < i>(It's still an artifact . ) < /i >"
Blurred Mongoose,1,2,{1}{G},Creature - Mongoose,Blurred Mongoose can't be countered . $Shroud < i > (This permanent can't be the target of spells or abilities . ) < /i >
Devouring Strossus,9,9,{5}{B}{B}{B},Creature - Horror,"Flying , trample$At the beginning of your upkeep , sacrifice a creature . $Sacrifice a creature : Regenerate Devouring Strossus ."
Geothermal Crevice,,,,Land,"Geothermal Crevice enters the battlefield tapped . ${tap }: Add { R } to your mana pool . ${tap } , Sacrifice Geothermal Crevice : Add { B}{G } to your mana pool ."
Kavu Titan,2,2,{1}{G},Creature - Kavu,"Kicker { 2}{G } < i > (You may pay an additional { 2}{G } as you cast this spell . ) < /i > $If Kavu Titan was kicked , it enters the battlefield with three +1/+1 counters on it and with trample ."
Opt,,,{U},Instant,Look at the top card of your library . You may put that card on the bottom of your library . $$Draw a card .
Raging Kavu,1,3,{1}{R}{G},Creature - Kavu,Flash$Haste
Savage Offensive,,,{1}{R},Sorcery,"Kicker { G } < i > (You may pay an additional { G } as you cast this spell . ) < /i > $Creatures you control gain first strike until end of turn . If Savage Offensive was kicked , they get +1/+1 until end of turn ."
Spirit of Resistance,,,{2}{W},Enchantment,"As long as you control a permanent of each color , prevent all damage that would be dealt to you ."
Tidal Visionary,1,1,{U},Creature - Merfolk Wizard,{ tap }: Target creature becomes the color of your choice until end of turn .
Urborg Skeleton,1,0,{B},Creature - Skeleton,"Kicker { 3 } < i > (You may pay an additional { 3 } as you cast this spell . ) < /i > ${B }: Regenerate Urborg Skeleton . $If Urborg Skeleton was kicked , it enters the battlefield with a +1/+1 counter on it ."
Winnow,,,{1}{W},Instant,Destroy target nonland permanent if another permanent with the same name is on the battlefield . $Draw a card .
Body Double,0,0,{4}{U},Creature - Shapeshifter,You may have Body Double enter the battlefield as a copy of any creature card in a graveyard .
Bearer of the Heavens,10,10,{7}{R},Creature - Giant,"When Bearer of the Heavens dies , destroy all permanents at the beginning of the next end step ."
Dictate of Erebos,,,{3}{B}{B},Enchantment,"Flash$Whenever a creature you control dies , each opponent sacrifices a creature ."
Font of Ire,,,{1}{R},Enchantment,"{ 3}{R } , Sacrifice Font of Ire : Font of Ire deals 5 damage to target player ."
Hypnotic Siren,1,1,{U},Enchantment Creature - Siren,"Bestow { 5}{U}{U } < i > (If you cast this card for its bestow cost , it's an Aura spell with enchant creature . It becomes a creature again if it's not attached to a creature . ) < /i > $Flying$You control enchanted creature . $Enchanted creature gets +1/+1 and has flying ."
Nightmarish End,,,{2}{B},Instant,"Target creature gets -X/-X until end of turn , where X is the number of cards in your hand ."
Returned Reveler,3,1,{1}{B},Creature - Zombie Satyr,"When Returned Reveler dies , each player puts the top three cards of his or her library into his or her graveyard ."
Skyspear Cavalry,2,2,{3}{W}{W},Creature - Human Soldier,Flying$Double strike < i > (This creature deals both first-strike and regular combat damage . ) < /i >
Triton Cavalry,4,2,{3}{U},Creature - Merfolk Soldier,"Heroic - Whenever you cast a spell that targets Triton Cavalry , you may return target enchantment to its owner's hand ."
Browbeat,,,{2}{R},Sorcery,"Any player may have Browbeat deal 5 damage to him or her . If no one does , target player draws three cards ."
Flash of Insight,,,{X}{1}{U},Instant,"Look at the top X cards of your library . Put one of them into your hand and the rest on the bottom of your library in any order . $Flashback-{1}{U } , Exile X blue cards from your graveyard . < i > (You may cast this card from your graveyard for its flashback cost , then exile it . You can't exile Flash of Insight to pay for its own flashback cost . ) < /i >"
Living Wish,,,{1}{G},Sorcery,"You may choose a creature or land card you own from outside the game , reveal that card , and put it into your hand . Exile Living Wish ."
Swelter,,,{3}{R},Sorcery,Swelter deals 2 damage to each of two target creatures .
Ainok Bond-Kin,1,2,{1}{W},Creature - Hound Soldier,"Outlast { 1}{W } < i > ({1}{W } , { tap }: Put a +1/+1 counter on this creature . Outlast only as a sorcery . ) < /i > $Each creature you control with a +1/+1 counter on it has first strike ."
Bloodfire Expert,1,3,{2}{R},Creature - Efreet Monk,"Prowess < i > (Whenever you cast a noncreature spell , this creature gets +1/+1 until end of turn . ) < /i >"
Defiant Strike,,,{W},Instant,Target creature gets +1/+0 until end of turn . $Draw a card .
Flying Crane Technique,,,{3}{U}{R}{W},Instant,Untap all creatures you control . They gain flying and double strike until end of turn .
Icefeather Aven,2,2,{G}{U},Creature - Bird Shaman,"Flying$Morph { 1}{G}{U } < i > (You may cast this card face down as a 2/2 creature for { 3 } . Turn it face up any time for its morph cost . ) < /i > $When Icefeather Aven is turned face up , you may return another target creature to its owner's hand ."
Lens of Clarity,,,{1},Artifact,You may look at the top card of your library and at face-down creatures you don't control . < i > (You may do this at any time . ) < /i >
Monastery Flock,5,0,{2}{U},Creature - Bird,"Defender , flying$Morph { U } < i > (You may cast this card face down as a 2/2 creature for { 3 } . Turn it face up any time for its morph cost . ) < /i >"
Rite of the Serpent,,,{4}{B}{B},Sorcery,"Destroy target creature . If that creature had a +1/+1 counter on it , put a 1/1 green Snake creature token onto the battlefield ."
Secret Plans,,,{G}{U},Enchantment,"Face-down creatures you control get +0/+1 . $Whenever a permanent you control is turned face up , draw a card ."
Summit Prowler,3,4,{2}{R}{R},Creature - Yeti,
Trap Essence,,,{G}{U}{R},Instant,Counter target creature spell . Put two +1/+1 counters on up to one target creature .
Winterflame,,,{1}{U}{R},Instant,Choose one or both -$ Tap target creature . $ Winterflame deals 2 damage to target creature .
Amrou Kithkin,1,1,{W}{W},Creature - Kithkin,Amrou Kithkin can't be blocked by creatures with power 3 or greater .
Flash Flood,,,{U},Instant,Choose one - Destroy target red permanent ; or return target Mountain to its owner's hand .
Kobolds of Kher Keep,1,0,{0},Creature - Kobold,
Relic Barrier,,,{2},Artifact,{ tap }: Tap target artifact .
Transmutation,,,{1}{B},Instant,Switch target creature's power and toughness until end of turn .
Canopy Crawler,2,2,{3}{G},Creature - Beast,"Amplify 1 < i > (As this creature enters the battlefield , put a +1/+1 counter on it for each Beast card you reveal in your hand . ) < /i > ${tap }: Target creature gets +1/+1 until end of turn for each +1/+1 counter on Canopy Crawler ."
Glowrider,1,2,{2}{W},Creature - Human Cleric,Noncreature spells cost { 1 } more to cast .
Nantuko Vigilante,2,3,{3}{G},Creature - Insect Druid Mutant,"Morph { 1}{G } < i > You may cast this card face downn as a 2/2 creature for { 3 } . Turn it face up any time for its morph cost . ) < /i > $When Nantuko Vigilante is turned face up , destroy target artifact or enchantment ."
