name,attack,defense,cost,type,text
Daru Cavalier,2,2,{3}{W},Creature - Human Soldier,"First strike$When Daru Cavalier enters the battlefield , you may search your library for a card named Daru Cavalier , reveal it , and put it into your hand . If you do , shuffle your library ."
Everglove Courier,1,2,{2}{G},Creature - Elf,"You may choose not to untap Everglove Courier during your untap step . ${2}{G } , { tap }: Target Elf creature gets +2/+2 and has trample for as long as Everglove Courier remains tapped ."
Goblin Sledder,1,1,{R},Creature - Goblin,Sacrifice a Goblin : Target creature gets +1/+1 until end of turn .
Insurrection,,,{5}{R}{R}{R},Sorcery,Untap all creatures and gain control of them until end of turn . They gain haste until end of turn .
Peer Pressure,,,{3}{U},Sorcery,"Choose a creature type . If you control more creatures of that type than each other player , you gain control of all creatures of that type . < i > (This effect lasts indefinitely . ) < /i >"
Shepherd of Rot,1,1,{1}{B},Creature - Zombie Cleric,{ tap }: Each player loses 1 life for each Zombie on the battlefield .
Steely Resolve,,,{1}{G},Enchantment,"As Steely Resolve enters the battlefield , choose a creature type . $Creatures of the chosen type have shroud . < i > (They can't be the targets of spells or abilities . ) < /i >"
Voidmage Prodigy,1,2,{U}{U},Creature - Human Wizard,"{ U}{U } , Sacrifice a Wizard : Counter target spell . $Morph { U } < i > You may cast this card face downn as a 2/2 creature for { 3 } . Turn it face up any time for its morph cost . ) < /i >"
Exotic Curse,,,{2}{B},Enchantment - Aura,Enchant creature$Domain - Enchanted creature gets -1/-1 for each basic land type among lands you control .
Brute Force,,,{R},Instant,Target creature gets +3/+3 until end of turn .
Evolution Charm,,,{1}{G},Instant,"Choose one - Search your library for a basic land card , reveal it , put it into your hand , then shuffle your library ; or return target creature card from your graveyard to your hand ; or target creature gains flying until end of turn ."
Imp's Mischief,,,{1}{B},Instant,Change the target of target spell with a single target . You lose life equal to that spell's converted mana cost .
Null Profusion,,,{4}{B}{B},Enchantment,"Skip your draw step . $Whenever you play a card , draw a card . $Your maximum hand size is two ."
Roiling Horror,*,*,{3}{B}{B},Creature - Horror,"Roiling Horror's power and toughness are each equal to your life total minus the life total of an opponent with the most life . $Suspend X-{X}{B}{B}{B } . X can't be 0 . < i > (Rather than cast this card from your hand , you may pay { X}{B}{B}{B } and exile it with X time counters on it . At the beginning of your upkeep , remove a time counter . When the last is removed , cast it without paying its mana cost . It has haste . ) < /i > $Whenever a time counter is removed from Roiling Horror while it's exiled , target player loses 1 life and you gain 1 life ."
Tidewalker,*,*,{2}{U},Creature - Elemental,"Tidewalker enters the battlefield with a time counter on it for each Island you control . $Vanishing < i > (At the beginning of your upkeep , remove a time counter from this permanent . When the last is removed , sacrifice it . )</i>$Tidewalker's power and toughness are each equal to the number of time counters on it ."
"Bosh, Iron Golem",7,6,{8},Legendary Artifact Creature - Golem,"Trample${3}{R } , Sacrifice an artifact : Bosh , Iron Golem deals damage equal to the sacrificed artifact's converted mana cost to target creature or player ."
Lodestone Myr,2,2,{4},Artifact Creature - Myr,Trample$Tap an untapped artifact you control : Lodestone Myr gets +1/+1 until end of turn .
Taurean Mauler,2,2,{2}{R},Creature - Shapeshifter,"Changeling < i > (This card is every creature type at all times . ) < /i > $Whenever an opponent casts a spell , you may put a +1/+1 counter on Taurean Mauler ."
Krosan Verge,,,,Land,"Krosan Verge enters the battlefield tapped . ${tap }: Add { C } to your mana pool . ${2 } , { tap } , Sacrifice Krosan Verge : Search your library for a Forest card and a Plains card and put them onto the battlefield tapped . Then shuffle your library ."
Whirlpool Warrior,2,2,{2}{U},Creature - Merfolk Warrior,"When Whirlpool Warrior enters the battlefield , shuffle the cards from your hand into your library , then draw that many cards . ${R } , Sacrifice Whirlpool Warrior : Each player shuffles the cards from his or her hand into his or her library , then draws that many cards ."
Disciple of Kangee,2,2,{2}{W},Creature - Human Wizard,"{ U } , { tap }: Target creature gains flying and becomes blue until end of turn ."
Keldon Mantle,,,{1}{R},Enchantment - Aura,Enchant creature${B }: Regenerate enchanted creature . ${R }: Enchanted creature gets +1/+0 until end of turn . ${G }: Enchanted creature gains trample until end of turn .
Phyrexian Scuta,3,3,{3}{B},Creature - Zombie,"Kicker-Pay 3 life . < i > (You may pay 3 life in addition to any other costs as you cast this spell . ) < /i > $If Phyrexian Scuta was kicked , it enters the battlefield with two +1/+1 counters on it ."
Singe,,,{R},Instant,Singe deals 1 damage to target creature . That creature becomes black until end of turn .
Treva's Ruins,,,,Land - Lair,"When Treva's Ruins enters the battlefield , sacrifice it unless you return a non-Lair land you control to its owner's hand . ${tap }: Add { G } , { W } , or { U } to your mana pool ."
Devastation,,,{5}{R}{R},Sorcery,Destroy all creatures and lands .
Mercenary Knight,4,4,{2}{B},Creature - Human Mercenary Knight,"When Mercenary Knight enters the battlefield , sacrifice it unless you discard a creature card ."
Spiritual Guardian,4,3,{3}{W}{W},Creature - Spirit,"When Spiritual Guardian enters the battlefield , you gain 4 life ."
Abyssal Nightstalker,2,2,{3}{B},Creature - Nightstalker,"Whenever Abyssal Nightstalker attacks and isn't blocked , defending player discards a card ."
Extinguish,,,{1}{U},Instant,Counter target sorcery spell .
Ogre Berserker,2,4,{4}{R},Creature - Ogre Berserker,Haste
Trokin High Guard,3,3,{3}{W},Creature - Human Knight,
"Diaochan, Artful Beauty",1,1,{3}{R},Legendary Creature - Human Advisor,"{ tap }: Destroy target creature of your choice , then destroy target creature of an opponent's choice . Activate this ability only during your turn , before attackers are declared ."
"Ma Chao, Western Warrior",3,3,{3}{R}{R},Legendary Creature - Human Soldier Warrior,"Horsemanship < i > (This creature can't be blocked except by creatures with horsemanship . ) < /i > $Whenever Ma Chao , Western Warrior attacks alone , it can't be blocked this combat ."
Shu Foot Soldiers,3,2,{2}{W},Creature - Human Soldier,
Wei Ambush Force,1,1,{1}{B},Creature - Human Soldier,"Whenever Wei Ambush Force attacks , it gets +2/+0 until end of turn ."
"Zhang Liao, Hero of Hefei",3,3,{4}{B}{B},Legendary Creature - Human Soldier,"Whenever Zhang Liao , Hero of Hefei deals damage to an opponent , that opponent discards a card ."
Glory,3,3,{{3}{W}{W},Creature - Incarnation,Flying${2}{W }: Choose a color . Creatures you control gain protection from the chosen color until end of turn . Activate this ability only if Glory is in your graveyard .
Fault Riders,2,2,{2}{R},Creature - Human Soldier,Sacrifice a land : Fault Riders gets +2/+0 and gains first strike until end of turn . Activate this ability only once each turn .
Mercenary Informer,1,2,{2}{W},Creature - Human Rebel Mercenary,Mercenary Informer can't be the target of black spells or abilities from black sources . ${2}{W }: Put target nontoken Mercenary on the bottom of its owner's library .
Shield Dancer,3,1,{2}{W},Creature - Human Rebel,"{ 2}{W }: The next time target attacking creature would deal combat damage to Shield Dancer this turn , that creature deals that damage to itself instead ."
Whip Sergeant,1,2,{2}{R},Creature - Human Soldier,{ R }: Target creature gains haste until end of turn . < i > (It can attack this turn . ) < /i >
Caregiver,1,1,{W},Creature - Human Cleric,"{ W } , Sacrifice a creature : Prevent the next 1 damage that would be dealt to target creature or player this turn ."
Dark Confidant,1,2,{1}{B},Creature - Human Wizard,"At the beginning of your upkeep , reveal the top card of your library and put that card into your hand . You lose life equal to its converted mana cost ."
Ethereal Usher,3,2,{5}{U},Creature - Spirit,"{ U } , { tap }: Target creature is unblockable this turn . $Transmute { 1}{U}{U } < i > ({1}{U}{U } , Discard this card : Search your library for a card with the same converted mana cost as this card , reveal it , and put it into your hand . Then shuffle your library . Transmute only as a sorcery . ) < /i >"
Golgari Grave-Troll,0,0,{4}{G},Creature - troll skeleton,"Golgari Grave-Troll enters the battlefield with a +1/+1 counter on it for each creature card in your graveyard . ${1 } , Remove a +1/+1 counter from Golgari Grave-Troll : Regenerate Golgari Grave-Troll . $Dredge 6 < i > (If you would draw a card , instead you may put exactly six cards from the top of your library into your graveyard . If you do , return this card from your graveyard to your hand . Otherwise , draw a card . ) < /i >"
Hunted Phantasm,6,4,{1}{U}{U},Creature - Spirit,"Hunted Phantasm is unblockable . $When Hunted Phantasm enters the battlefield , put five 1/1 red Goblin creature tokens onto the battlefield under target opponent's control ."
Muddle the Mixture,,,{U}{U},Instant,"Counter target instant or sorcery spell . $Transmute { 1}{U}{U } < i > ({1}{U}{U } , Discard this card : Search your library for a card with the same converted mana cost as this card , reveal it , and put it into your hand . Then shuffle your library . Transmute only as a sorcery . ) < /i >"
Remand,,,{1}{U},Instant,"Counter target spell . If that spell is countered this way , put it into its owner's hand instead of into that player's graveyard . $Draw a card ."
Shambling Shell,1,3,{1}{B}{G},Creature - Plant Zombie,"Sacrifice Shambling Shell : Put a +1/+1 counter on target creature . $Dredge 3 < i > (If you would draw a card , instead you may put exactly three cards from the top of your library into your graveyard . If you do , return this card from your graveyard to your hand . Otherwise , draw a card . ) < /i >"
Terrarion,,,{1},Artifact,"Terrarion enters the battlefield tapped . ${2 } , { tap } , Sacrifice Terrarion : Add two mana in any combination of colors to your mana pool . $When Terrarion is put into a graveyard from the battlefield , draw a card ."
Voyager Staff,,,{1},Artifact,"{ 2 } , Sacrifice Voyager Staff : Exile target creature . Return the exiled card to the battlefield under its owner's control at the beginning of the next end step ."
Azorius Arrester,1,2,{1}{W},Creature - Human Soldier,"When Azorius Arrester enters the battlefield , detain target creature an opponent controls . < i > (Until your next turn , that creature can't attack or block and its activated abilities can't be activated . ) < /i >"
Chorus of Might,,,{3}{G},Instant,"Until end of turn , target creature gets +1/+1 for each creature you control and gains trample ."
Deathrite Shaman,2,1,{BG},Creature - Elf Shaman,"{ tap }: Exile target land card from a graveyard . Add one mana of any color to your mana pool . ${B } , { tap }: Exile target instant or sorcery card from a graveyard . Each opponent loses 2 life . ${G } , { tap }: Exile target creature card from a graveyard . You gain 2 life ."
Explosive Impact,,,{5}{R},Instant,Explosive Impact deals 5 damage to target creature or player .
Grove of the Guardian,,,,Land,"{ tap }: Add { C } to your mana pool . ${3}{G}{W } , { tap } , Tap two untapped creatures you control , Sacrifice Grove of the Guardian : Put an 8/8 green and white Elemental creature token with vigilance onto the battlefield ."
Jarad's Orders,,,{2}{B}{G},Sorcery,Search your library for up to two creature cards and reveal them . Put one into your hand and the other into your graveyard . Then shuffle your library .
Nivmagus Elemental,2,1,{UR},Creature - Elemental,Exile an instant or sorcery spell you control : Put two +1/+1 counters on Nivmagus Elemental . < i > (That spell won't resolve . ) < /i >
Rakdos Shred-Freak,1,2,{BR}{BR},Creature - Human Berserker,Haste
Sewer Shambler,1,2,{2}{B},Creature - Zombie,"Swampwalk < i > (This creature is unblockable as long as defending player controls a Swamp . ) < /i > $Scavenge { 2}{B } < i > ({2}{B } , Exile this card from your graveyard : Put a number of +1/+1 counters equal to this card's power on target creature . Scavenge only as a sorcery . ) < /i >"
Street Spasm,,,{X}{R},Instant,"Street Spasm deals X damage to target creature without flying you don't control . $Overload { X}{X}{R}{R } < i > (You may cast this spell for its overload cost . If you do , change its text by replacing all instances of "" target "" with "" each . "" ) < /i >"
Trestle Troll,4,1,{1}{B}{G},Creature - Troll,Defender$Reach < i > (This creature can block creatures with flying . ) < /i > ${1}{B}{G }: Regenerate Trestle Troll .
Desert Twister,,,{4}{G}{G},Sorcery,Destroy target permanent .
Battle Rampart,3,1,{2}{R},Creature - Wall,Defender${tap }: Target creature gains haste until end of turn .
Dawnglare Invoker,1,2,{2}{W},Creature - Kor Wizard,Flying${8 }: Tap all creatures target player controls .
"Emrakul, the Aeons Torn",15,15,{15},Legendary Creature - Eldrazi,"Emrakul , the Aeons Torn can't be countered . $When you cast Emrakul , take an extra turn after this one . $Flying , protection from colored spells , annihilator 6$When Emrakul is put into a graveyard from anywhere , its owner shuffles his or her graveyard into his or her library ."
Grotag Siege-Runner,1,2,{1}{R},Creature - Goblin Rogue,"{ R } , Sacrifice Grotag Siege-Runner : Destroy target creature with defender . Grotag Siege-Runner deals 2 damage to that creature's controller ."
Kiln Fiend,2,1,{1}{R},Creature - Elemental Beast,"Whenever you cast an instant or sorcery spell , Kiln Fiend gets +3/+0 until end of turn ."
Merfolk Skyscout,3,2,{2}{U}{U},Creature - Merfolk Scout,"Flying$Whenever Merfolk Skyscout attacks or blocks , untap target permanent ."
Pawn of Ulamog,2,2,{1}{B}{B},Creature - Vampire Shaman,"Whenever Pawn of Ulamog or another nontoken creature you control dies , you may put a 0/1 colorless Eldrazi Spawn creature token onto the battlefield . It has "" Sacrifice this creature : Add { C } to your mana pool . """
Sarkhan the Mad,,,{3}{B}{R},Planeswalker - Sarkhan,"0 : Reveal the top card of your library and put it into your hand . Sarkhan the Mad deals damage to himself equal to that card's converted mana cost . $-2 : Target creature's controller sacrifices it , then that player puts a 5/5 red Dragon creature token with flying onto the battlefield . $-4 : Each Dragon creature you control deals damage equal to its power to target player ."
Stalwart Shield-Bearers,3,0,{1}{W},Creature - Human Soldier,Defender$Other creatures you control with defender get +0/+2 .
Vengevine,3,4,{2}{G}{G},Creature - Elemental,"Haste$Whenever you cast a spell , if it's the second creature spell you cast this turn , you may return Vengevine from your graveyard to the battlefield ."
Bounteous Kirin,4,4,{5}{G}{G},Legendary Creature - Kirin Spirit,"Flying$Whenever you cast a Spirit or Arcane spell , you may gain life equal to that spell's converted mana cost ."
Dreamcatcher,1,1,{U},Creature - Spirit,"Whenever you cast a Spirit or Arcane spell , you may sacrifice Dreamcatcher . If you do , draw a card ."
Glitterfang,1,1,{R},Creature - Spirit,"Haste$At the beginning of the end step , return Glitterfang to its owner's hand ."
Kagemaro's Clutch,,,{3}{B},Enchantment - Aura,"Enchant creature$Enchanted creature gets -X/-X , where X is the number of cards in your hand ."
Matsu-Tribe Birdstalker,2,2,{2}{G}{G},Creature - Snake Warrior Archer,"Whenever Matsu-Tribe Birdstalker deals combat damage to a creature , tap that creature and it doesn't untap during its controller's next untap step . ${G }: Matsu-Tribe Birdstalker gains reach until end of turn . < i > (It can block creatures with flying . ) < /i >"
Oni of Wild Places,5,6,{5}{R},Creature - Demon Spirit,"Haste$At the beginning of your upkeep , return a red creature you control to its owner's hand ."
Sakashima the Impostor,1,3,{2}{U}{U},Legendary Creature - Human Rogue,"You may have Sakashima the Impostor enter the battlefield as a copy of any creature on the battlefield , except its name is still Sakashima the Impostor , it's legendary in addition to its other types , and it gains "" { 2}{U}{U }: Return Sakashima the Impostor to its owner's hand at the beginning of the next end step . """
"Soramaro, First to Dream",*,*,{4}{U}{U},Legendary Creature - Spirit,"Flying$Soramaro , First to Dream's power and toughness are each equal to the number of cards in your hand . ${4 } , Return a land you control to its owner's hand : Draw a card ."
Asceticism,,,{3}{G}{G},Enchantment,Creatures you control have hexproof . < i > (They can't be the targets of spells or abilities your opponents control . ) < /i > ${1}{G }: Regenerate target creature .
Carrion Call,,,{3}{G},Instant,Put two 1/1 green Insect creature tokens with infect onto the battlefield . < i > (They deal damage to creatures in the form of -1/-1 counters and to players in the form of poison counters . ) < /i >
Dispense Justice,,,{2}{W},Instant,Target player sacrifices an attacking creature . $Metalcraft - That player sacrifices two attacking creatures instead if you control three or more artifacts .
Galvanic Blast,,,{R},Instant,Galvanic Blast deals 2 damage to target creature or player . $Metalcraft - Galvanic Blast deals 4 damage to that creature or player instead if you control three or more artifacts .
Hoard-Smelter Dragon,5,5,{4}{R}{R},Creature - Dragon,"Flying${3}{R }: Destroy target artifact . Hoard-Smelter Dragon gets +X/+0 until end of turn , where X is that artifact's converted mana cost ."
Lumengrid Drake,2,2,{3}{U},Creature - Drake,"Flying$Metalcraft - When Lumengrid Drake enters the battlefield , if you control three or more artifacts , return target creature to its owner's hand ."
Necropede,1,1,{2},Artifact Creature - Insect,"Infect < i > (This creature deals damage to creatures in the form of -1/-1 counters and to players in the form of poison counters . ) < /i > $When Necropede dies , you may put a -1/-1 counter on target creature ."
Psychic Miasma,,,{1}{B},Sorcery,"Target player discards a card . If a land card is discarded this way , return Psychic Miasma to its owner's hand ."
Shape Anew,,,{3}{U},Sorcery,"The controller of target artifact sacrifices it , then reveals cards from the top of his or her library until he or she reveals an artifact card . That player puts that card onto the battlefield , then shuffles all other cards revealed this way into his or her library ."
Tangle Angler,5,1,{3}{G},Creature - Horror,Infect < i > (This creature deals damage to creatures in the form of -1/-1 counters and to players in the form of poison counters . ) < /i > ${G }: Target creature blocks Tangle Angler this turn if able .
Vault Skyward,,,{U},Instant,Target creature gains flying until end of turn . Untap it .
Aven Farseer,1,1,{1}{W},Creature - Bird Soldier,"Flying$Whenever a permanent is turned face up , put a +1/+1 counter on Aven Farseer ."
Dragon Tyrant,6,6,{8}{R}{R},Creature - Dragon,"Flying , trample$Double strike < i > (This creature deals both first-strike and regular combat damage . ) < /i > $At the beginning of your upkeep , sacrifice Dragon Tyrant unless you pay { R}{R}{R}{R } . ${R }: Dragon Tyrant gets +1/+0 until end of turn ."
Noble Templar,6,3,{5}{W},Creature - Human Cleric Soldier,"Vigilance$Plainscycling { 2 } < i > ({2 } , Discard this card : Search your library for a Plains card , reveal it , and put it into your hand . Then shuffle your library . ) < /i >"
Tendrils of Agony,,,{2}{B}{B},Sorcery,"Target player loses 2 life and you gain 2 life . $Storm < i > (When you cast this spell , copy it for each spell cast before it this turn . You may choose new targets for the copies . ) < /i >"
Ancestral Memories,,,{2}{U}{U}{U},Sorcery,Look at the top seven cards of your library . Put two of them into your hand and the rest into your graveyard .
Grapeshot Catapult,3,2,{4},Artifact Creature - Construct,{ tap }: Grapeshot Catapult deals 1 damage to target creature with flying .
Pyrotechnics,,,{4}{R},Sorcery,Pyrotechnics deals 4 damage divided as you choose among any number of target creatures and/or players .
Thoughtleech,,,{G}{G},Enchantment,"Whenever an Island an opponent controls becomes tapped , you may gain 1 life ."
Barrenton Medic,4,0,{4}{W},Creature - Kithkin Cleric,{ tap }: Prevent the next 1 damage that would be dealt to target creature or player this turn . $Put a -1/-1 counter on Barrenton Medic : Untap Barrenton Medic .
Cinderhaze Wretch,2,3,{4}{B},Creature - Elemental Shaman,{ tap }: Target player discards a card . Activate this ability only during your turn . $Put a -1/-1 counter on Cinderhaze Wretch : Untap Cinderhaze Wretch .
Dream Salvage,,,{UB},Instant,Draw cards equal to the number of cards target opponent discarded this turn .
Flow of Ideas,,,{5}{U},Sorcery,Draw a card for each Island you control .
Grief Tyrant,8,8,{5}{BR},Creature - Horror,"Grief Tyrant enters the battlefield with four -1/-1 counters on it . $When Grief Tyrant dies , put a -1/-1 counter on target creature for each -1/-1 counter on Grief Tyrant ."
Kinscaer Harpoonist,2,2,{3}{U},Creature - Kithkin Soldier,"Flying$Whenever Kinscaer Harpoonist attacks , you may have target creature lose flying until end of turn ."
Medicine Runner,1,2,{1}{GW},Creature - Elf Cleric,"When Medicine Runner enters the battlefield , you may remove a counter from target permanent ."
Nurturer Initiate,1,1,{G},Creature - Elf Shaman,"Whenever a player casts a green spell , you may pay { 1 } . If you do , target creature gets +1/+1 until end of turn ."
Puppeteer Clique,2,3,{3}{B}{B},Creature - Faerie Wizard,"Flying$When Puppeteer Clique enters the battlefield , put target creature card from an opponent's graveyard onto the battlefield under your control . It gains haste . At the beginning of your next end step , exile it . $Persist < i > (When this creature dies , if it had no -1/-1 counters on it , return it to the battlefield under its owner's control with a -1/-1 counter on it . ) < /i >"
Runed Halo,,,{W}{W},Enchantment,"As Runed Halo enters the battlefield , name a card . $You have protection from the chosen name . < i > (You can't be targeted , dealt damage , or enchanted by anything with that name . ) < /i >"
Slinking Giant,4,4,{2}{R}{R},Creature - Giant Rogue,"Wither < i > (This deals damage to creatures in the form of -1/-1 counters . ) < /i > $Whenever Slinking Giant blocks or becomes blocked , it gets -3/-0 until end of turn ."
Thistledown Duo,2,2,{2}{WU},Creature - Kithkin Soldier Wizard,"Whenever you cast a white spell , Thistledown Duo gets +1/+1 until end of turn . $Whenever you cast a blue spell , Thistledown Duo gains flying until end of turn ."
Whimwader,4,6,{4}{U},Creature - Elemental,Whimwader can't attack unless defending player controls a blue permanent .
Algae Gharial,1,1,{3}{G},Creature - Crocodile,"Shroud$Whenever another creature dies , you may put a +1/+1 counter on Algae Gharial ."
Broodmate Dragon,4,4,{3}{B}{R}{G},Creature - Dragon,"Flying$When Broodmate Dragon enters the battlefield , put a 4/4 red Dragon creature token with flying onto the battlefield ."
Dawnray Archer,1,1,{2}{U},Creature - Human Archer,"Exalted < i > (Whenever a creature you control attacks alone , that creature gets +1/+1 until end of turn . ) < /i > ${W } , { tap }: Dawnray Archer deals 1 damage to target attacking or blocking creature ."
Ethersworn Canonist,2,2,{1}{W},Artifact Creature - Human Cleric,Each player who has cast a nonartifact spell this turn can't cast additional nonartifact spells .
Grixis Panorama,,,,Land,"{ tap }: Add { C } to your mana pool . ${1 } , { tap } , Sacrifice Grixis Panorama : Search your library for a basic Island , Swamp , or Mountain card and put it onto the battlefield tapped . Then shuffle your library ."
Kederekt Leviathan,5,5,{6}{U}{U},Creature - Leviathan,"When Kederekt Leviathan enters the battlefield , return all other nonland permanents to their owners ' hands . $Unearth { 6}{U } < i > ({6}{U }: Return this card from your graveyard to the battlefield . It gains haste . Exile it at the beginning of the next end step or if it would leave the battlefield . Unearth only as a sorcery . ) < /i >"
Mosstodon,3,5,{4}{G},Creature - Plant Elephant,{ 1 }: Target creature with power 5 or greater gains trample until end of turn .
Qasali Ambusher,3,2,{1}{G}{W},Creature - Cat Warrior,"Reach$If a creature is attacking you and you control a Forest and a Plains , you may cast Qasali Ambusher without paying its mana cost and as though it had flash ."
Sanctum Gargoyle,3,2,{3}{W},Artifact Creature - Gargoyle,"Flying$When Sanctum Gargoyle enters the battlefield , you may return target artifact card from your graveyard to your hand ."
Skeletonize,,,{4}{R},Instant,"Skeletonize deals 3 damage to target creature . When a creature dealt damage this way dies this turn , put a 1/1 black Skeleton creature token onto the battlefield with "" { B }: Regenerate this creature . """
Thunder-Thrash Elder,1,1,{2}{R},Creature - Viashino Warrior,"Devour 3 < i > (As this enters the battlefield , you may sacrifice any number of creatures . This creature enters the battlefield with three times that many +1/+1 counters on it . ) < /i >"
Windwright Mage,2,2,{W}{U}{B},Artifact Creature - Human Wizard,Lifelink < i > (Damage dealt by this creature also causes you to gain that much life . ) < /i > $Windwright Mage has flying as long as an artifact card is in your graveyard .
